{
  "profileId": "spotcomp-predication-fiber-candidate",
  "base": {
    "parameterLatticeDeclared": true,
    "predicateCategoryDeclared": true,
    "entitySetDeclared": true,
    "predicateFamilyUniform": true,
    "chargeCarrier": "L x L",
    "evidence": [
      "development/active/articulating/library/aperiodic-predication-category/library/aperiodic-predication-cell/library/potential-aperiodic-predication-cell/predicating/library/transfinite-predication-category/positing/library/predication-fibration/library/predication-fiber-algebra/docs/dev/journal/2026-05-24.md",
      "lab/archive/library/humanities/library/math/library/categories/theories/predication-theory/code/structures/predication-fiber-algebra.md"
    ]
  },
  "fiberAlgebra": {
    "formula": "A_p = (L x L)^(E x E)",
    "index": "E x E",
    "chargeComponents": ["positive-evidence", "negative-evidence"],
    "valuationAcrossPredicates": "p |-> A_p",
    "pointwiseOperations": true,
    "knowledgeOrderStructural": true,
    "truthOrderLoadBearing": true,
    "uniformAcrossPredicates": true,
    "evidence": [
      "development/active/articulating/library/aperiodic-predication-category/library/aperiodic-predication-cell/library/potential-aperiodic-predication-cell/predicating/library/transfinite-predication-category/positing/library/predication-fibration/library/predication-fiber-algebra/docs/dev/journal/2026-05-24.md"
    ]
  },
  "operations": {
    "knowledgeMeet": { "declared": true, "pointwise": true },
    "knowledgeJoin": { "declared": true, "pointwise": true },
    "truthMeet": { "declared": true, "pointwise": true },
    "truthJoin": { "declared": true, "pointwise": true },
    "negation": { "declared": true, "pointwise": true, "formula": "swap positive and negative evidence components" },
    "fusion": {
      "declared": true,
      "pointwise": true,
      "formula": "(alpha, beta) odot (gamma, delta) = (alpha . gamma, (alpha -> delta) meet (gamma -> beta))"
    },
    "residual": {
      "declared": true,
      "pointwise": true,
      "formula": "(alpha, beta) => (gamma, delta) = ((alpha -> gamma) meet (delta -> beta), alpha . delta)"
    },
    "negationSwapsEvidence": true,
    "fusionResidualTruthAdjunction": true,
    "evidence": [
      "development/active/articulating/library/aperiodic-predication-category/library/aperiodic-predication-cell/library/potential-aperiodic-predication-cell/predicating/library/transfinite-predication-category/positing/library/predication-fibration/library/predication-fiber-algebra/docs/dev/journal/2026-05-24.md",
      "lab/archive/library/humanities/library/math/library/categories/theories/predication-theory/prose/learning/claims/twist-product-residuation.md"
    ]
  },
  "fibration": {
    "kind": "cloven-grothendieck-fibration",
    "baseCategory": "predicate-category",
    "axioms": ["fiber-uniformity", "generator-action", "fiber-structure-preservation"],
    "generatorClasses": ["specialization", "converse", "subject-projection", "object-projection"],
    "reindexingsAreBilatticeResiduatedHomomorphisms": true,
    "knowledgeMonotone": true,
    "functor": "C^op -> DBiLat(L)",
    "evidence": [
      "development/active/articulating/library/aperiodic-predication-category/library/aperiodic-predication-cell/library/potential-aperiodic-predication-cell/predicating/library/transfinite-predication-category/positing/library/predication-fibration/docs/dev/journal/2026-05-24.md",
      "lab/archive/library/humanities/library/math/library/categories/theories/predication-theory/code/structures/predication-fibration.md",
      "/predication-categories/library/predication-cell-complex-site/content/explanations/exhaustiveness-of-four-predication-cell-complex-site-generators.md"
    ]
  },
  "hyperdoctrine": {
    "propertyLike": true,
    "requiresFibration": true,
    "axioms": [
      "knowledge-quantifier-adjoints",
      "truth-quantifier-adjoints",
      "knowledge-frobenius",
      "truth-frobenius",
      "beck-chevalley",
      "dual-comprehension"
    ],
    "fusionFrobeniusAvailable": false,
    "twoAdjointSystemsIndependent": true,
    "classicalCollapseMergesAdjoints": true,
    "evidence": [
      "development/active/articulating/library/aperiodic-predication-category/library/aperiodic-predication-cell/library/potential-aperiodic-predication-cell/predicating/library/transfinite-predication-category/positing/library/predication-fibration/library/predication-hyperdoctrine/docs/dev/journal/2026-05-24.md",
      "lab/archive/library/humanities/library/math/library/categories/theories/predication-theory/code/structures/predication-hyperdoctrine.md"
    ]
  },
  "specializationBoundary": {
    "fourIsBooleanSpecialization": true,
    "fourOnlyWhenLIsBoolean": true,
    "booleanCollapseOptional": true,
    "classicalRelationIsDoubleCollapse": true,
    "nonFourFibersLegal": true,
    "activeFourCodeProjectionOnly": true,
    "evidence": [
      "development/active/articulating/library/aperiodic-predication-category/library/aperiodic-predication-cell/library/potential-aperiodic-predication-cell/predicating/library/transfinite-predication-category/positing/library/predication-fibration/library/predication-fiber-algebra/docs/dev/journal/2026-05-24.md",
      "PREDICATION-STAGES.md"
    ]
  },
  "implementationBoundary": {
    "traceValuesCarryDeclaredFiber": true,
    "rejectUndeclaredFiberCarrier": true,
    "doNotRequireFourValues": true,
    "finiteProjectionMayTargetFour": true,
    "preserveDatumAcrossReindexing": true,
    "reindexingMustDeclareGeneratorClass": true,
    "evidence": [
      "PREDICATION-FIBER-ALGEBRA.md",
      "POSITING.md",
      "TRACE-AXES.md"
    ]
  },
  "openObligations": [
    "Prove that the active predication fibration satisfies A1-A3 for the declared lattice and predicate category.",
    "Prove hyperdoctrine B1-B4 for the SPOTCOMP predicate category before treating quantifier closure as normative.",
    "Replace active FOUR-only code paths with declared finite specialization boundaries."
  ],
  "evidence": [
    "PREDICATION-FIBER-ALGEBRA.md",
    "DERIVATION-OBLIGATIONS.md D2"
  ]
}
